video_id,comment,like_count
27rnvRkE1OM,The Only EV I would ever own is GMC's HummerEV,0
27rnvRkE1OM,GM Why are we going all electric? Please tell me. You already think it will be a success. But reality it won't work,0
27rnvRkE1OM,You pulled your Twitter ads. You WOKE COWARDS. Boycott this discussing cancer of a company.,0
27rnvRkE1OM,GM’s CEO must GO I will no longer buy any GM vehicle as long as she is ceo,0
27rnvRkE1OM,My city just canceled the order of GM vehicles for its city public works and police departments over the Twitter move. Thank you for self exposing this company. I’ll never buy a GM ever again as well,1
27rnvRkE1OM,"As far as I'm concerned as long as this company is playing politics I will never buy one of their vehicles. So expect GM to fail once again because they went ahead and took their stand well the people are about to take their stand too and the side she's falling on is very unpopular right now so,.. good riddance GM. Hope you all get trapped in a structure fire. Why you would put yourself on a list with Pfizer it's beyond me.. put your pronouns in your Twitter bio lady you know what I'm going to do I'm going to put my money where my mouth is. And check that out I'm going to be ready to buy a new vehicle within the next year, but because of these shenanigans I will not be buying a GM vehicle or a Cadillac,",0
27rnvRkE1OM,JUNK ALL JUNK GM,1
27rnvRkE1OM,"Go ahead, and dive into the Disney rabbit hole. If you're interested in free speech you better change your position and do it quickly.",1
27rnvRkE1OM,"Well, you blew it with me, I was a General Motors regular customer, but no longer, I believe in free speech, but if you aren't interested in that, see you!",1
27rnvRkE1OM,If you own a general motor's car take the emblem off and replace it with a twitter bird.,1
27rnvRkE1OM,No more Ads no more GM in my life. Boycotting Twitter is a shame. Y’all want a single brain customer 🎃🤮🤮🤮,1
27rnvRkE1OM,"Now that we know not to buy GM because of their support for loony leftists, what are some good vehicle manufacturers to look at?",0
27rnvRkE1OM,#BoyCottGM,1
27rnvRkE1OM,Worry less about social media and more about supplying parts for the vehicles you have sold.,2
27rnvRkE1OM,"I am fully restoring a Chevy pickup truck and have put $27,000 in the truck so far.  I will be removing the logos from my Chevy truck tomorrow.  

 Hell I might even put Twitter logos On it instead.   I bet that will catch some eyes. 

That's what I think about your anti-American views.",0
27rnvRkE1OM,"I'm a Ford and Chevy Person, but I can promise you I won't ever buy GM ever again in my entire life. I don't care if they start to make the world's best vehicle. 

They're an anti-American company. They don't value the constitution freedom of speech the way american companies should. 

GM as an american company is over. They may as well be recognized as a chinese company now.",0
27rnvRkE1OM,I love 2023 buick design = perfect,0
27rnvRkE1OM,Make America Great Again,2
27rnvRkE1OM,Your censorship bully move to not advertise on Twitter due to new owner is unacceptable.,8
27rnvRkE1OM,"GM purposely sold GM trucks knowing those low quality lifters were going to break.,basically shit on their customers even after they got a bail out that tax payers are accountable for .",1
27rnvRkE1OM,Me and family will no longer support a company who supports WOKE pedophilia.  . #biycottgm,0
27rnvRkE1OM,"Always had, but as of today, I have never been happier to own a Chevy.  It's good to know that General Motors hates the likes of me and over half of Americans just because they believe in constitutional free speech.  Wow, that was surprising.  But great to know those who hate you.",0
27rnvRkE1OM,"When you prioritize based on race, you're a racist company. If you leave Twitter you're against freedom of speech. You're showing your true agenda and that's why I won't buy anything GM related.",0
27rnvRkE1OM,"Pausing ads on Twitter because of your politics huh

YOU ARE A CAR MAKER NOT A DAMN POLITICAL ACTION GROUP. I WILL NEVER BUY GM AGAIN AFTER THIS INSULT",5
27rnvRkE1OM,"Leave twitter,  show your true agenda,  and then promptly go bankrupt.",6
27rnvRkE1OM,Don't think you won't get cancelled if you leave Twitter.    I'm already gearing yup to buy a Tesla.    LET THAT SINK IN !!!      😁,7
27rnvRkE1OM,Planning on getting another 2500 truck when prices dip a bit. It will not be a Chevy if GM sides with the left over Elon Musks purchase of Twitter. I will also urge every Chevy owner I can to not buy another one. Politics and business need to stay separate..,4
27rnvRkE1OM,F ck GM.....Twitter shjt bags....bc your products,0
27rnvRkE1OM,Will GMC Sierra EV be a live event?,0
27rnvRkE1OM,you gave priority and attention to Brazilians in the creation of the automatic transmission... that's why my appreciation for general motors,0
27rnvRkE1OM,I have a better engine than tesla. better than the ones Elon musk is trying to build. #findnewroadsforever,0
27rnvRkE1OM,"Cadillac gives good advice. In Korea, SUVs like Ford's Raptor don't go around very often. Why? I don't like that kind of design. I like angled muscle-type sedans or sports sedans.",0
27rnvRkE1OM,"Corvette and Cadillac are the designs that do not lose to Ferrari and Rolls Royce. Ford seems to only like SUVs, so it's not popular in Korea.",0
27rnvRkE1OM,"Cadillac has many lines of muscle-type sedans with perfect design. Koreans don't like SUVs. Cadillac sedans are pretty, and SUVs are pretty. And Cadillac will be the best if it comes up with a design like the Corvette.",0
27rnvRkE1OM,"I bought my last GM product years ago. Now you have to pay $1500 up front for a subscription to on star. You don’t have a choice they include it in the price of the vehicle. I was gonna buy a new Silverado this year, but not anymore. I don’t want on star, and I don’t want to buy a subscription to it by force.",1
27rnvRkE1OM,Can GM please bring back Oldsmobile.,0
27rnvRkE1OM,can you bring back Pontiac a idea to get it started start off with  new fire bird trans am RWD V8 and V6 engines and if you want you make eletric version like the gas car and a ev you could get a lot of business that way fill your electric line up and a new muscle car im not that young of a car guy so i dont know a lot,2
uTOzg8Tp4F0,"Beaten by Tesla, retaliating on Twitter. Pathetic brand 🤮🤣🤣Losers 😖",0
uTOzg8Tp4F0,No more Ads no more GM in my life. Boycotting Twitter is a shame. Y’all want a single brain customer 🎃🤮🤮🤮,1
uTOzg8Tp4F0,Gimme a break GM,1
uTOzg8Tp4F0,I will not ever ! Buy a GM product again since your FORCING new car buyers to purchase 3 years of onstar and adding it into the price. This probably the most UNETHICAL practice I’ve ever heard of. You are no longer “professional grade”,0
uTOzg8Tp4F0,Great work TeamGM 👏,0
uTOzg8Tp4F0,Toyota is better (I bought one last week I am very happy with it),0
uTOzg8Tp4F0,"GM's working culture is so toxic. If you are an engineer, don't come here. Too much office politics and useless managers.",1
uTOzg8Tp4F0,"Dear GM ,
  If you want to be remarkable company
PLZ give more attention to Corvette & Camaro!!!

Please",0
uTOzg8Tp4F0,General Motive,0
uTOzg8Tp4F0,General Motors is the BEST company of the WORLD !,1
uTOzg8Tp4F0,Whistling past the graveyard.,1
uTOzg8Tp4F0,Its called a gang.  Groups vs individuals in a competition to survive. Gangs,2
uTOzg8Tp4F0,GM has not competitive advantage. Go work at Tesla.,2
uTOzg8Tp4F0,A vehicle for the rich and stupid not practical too expensive and a recycling nightmare the era of bling is back common sense is out the window.,0
uTOzg8Tp4F0,Worked at GM for three years two decades ago. They were competetive and performed well in the market. The direction that they've been going through since the bailout seems like they will be out of business after the next market collapse. Tesla and Ford are eating them for lunch and that shows up in the quality and competitiveness of the product.,3
uTOzg8Tp4F0,This is where they produce eco-piglets?,0
uTOzg8Tp4F0,GM got the Corvette right. 🤞Hopefully the UAW and management work together.,0
uTOzg8Tp4F0,One day it will come A I into GM it will completely take over your jobs and nobody at GM will have a job because of A I intelligent robot. Will completely take over GM and run it.,0
uTOzg8Tp4F0,"NOW I see the reason for the decline in quality at GM!  Too many women.  There's a lot of time spent on gossip and bickering, and less time spent on getting the quality work done. 
Wise up GM, after the #metoo fake news exploded, hiring females is risky practice. Amber #poopthebed Turd backs up the truth. #shelies #nohire #nomentor",0
uTOzg8Tp4F0,"GM is doomed I'm afraid. They haven't procured enough batteries to produce enough vehicles. The vehicles are way too heavy, so the ranges are poor. They're going to be overwhelmed by Tesla and Chinese manufacturers who are more nimble and innovative. GM, you blew it. You made the first viable electric car, then let the dealers and oil companies bully you into scrapping them. Customers loved them, but you put yourself first. Shame on you, you deserve what's coming.",10
uTOzg8Tp4F0,Chevy Silverado Full EV Base is the truck to have,1
uTOzg8Tp4F0,What Are In General Motors (A-Body FWD) Platform on Automatic Transmission (Floor/Console & Steering Column Mounted) Shifters Used from (1982-1996 Makes/Models Updated History) is?,0
uTOzg8Tp4F0,What Are In General Motors (A-Body FWD) Platform for Mid-Size Cars (Coupes-Sedans-Station Wagons) on Exterior/Interior-(Updates) Used from (1982-1996 Makes/Models Updated History) is?,0
uTOzg8Tp4F0,"1.What Are In General Motors (H-Body FWD) Platform for Full-Size Cars (Coupes-Sedans) on 1st-2nd Generations in Exterior/Interior-(Updates) Used from (1986-1999 Makes/Models Updated History) is?

2.What Are In General Motors (H-Body FWD) Platform on Automatic Transmission (Floor/Console & Steering Column Mounted) Shifters Used from (1986-1999 Makes/Models Updated History) is?",0
uTOzg8Tp4F0,nice,1
uTOzg8Tp4F0,"1.What Are In General Motors (C-Body, G-Body, H-Body, and K-Body FWD) Platforms for Full-Size Cars (Coupes-Sedans) on 1st-3rd Generations in Exterior/Interior-(Updates) Used from (1980-2011 Makes/Models Updated History) is?

2.What Are In General Motors (C-Body, G-Body, H-Body, and K-Body FWD) Platforms on Automatic Transmission (Floor/Console & Steering Column Mounted) Shifters Used from (1980-2011 Makes/Models Updated History) is?",0
uTOzg8Tp4F0,I love Chevy I want to work at GM I want the impala back,4
x_Fxfp75mrs,"I purchased a used car a Chevy cruze from a local dealership in Timmins,,my car broke down  after 1 year,,I called the dealership, too ask about my warranty,,where sorry ron your warranty ran out last month,,now  my car is broken dealership won't fix my car unless I pay the huge amount of money, I can't afford,,,,now it's winter I was using  half water and antifreeze,,but it got cold,,even had my car plugged in,,still it froz,,now iv got bigger problems probably the engine block cracked from frozen,,can you help me out I need my vehicle for medical appointments and ,family members  need a ride often,,I'd really like too try a electric vehicle,,in winter,,can you donate one electric vehicle, it would be used  often  for myself and family members trips too Timmins 1hr drive or the Sudbury trip,,Costco shopping,,the wife's favorite store my 9 year old girl, loves Costco shopping,,me pushing the cart around 3 hrs, ,the ride back too Timmins too Sudbury 3,1/2,,hrs,,being older on a limited budget that car but me in the hole,,it's all payed off the day I got it,,now it's broken not even long enough too enjoy a family trip, ,so disappointed in the dealership, for taking my money with  a 1year warranty, it ruined our Christmas shopping, doctors appointments, taking my little girl too school each morning all year that dealership in Timmins really messed up on used car sale failure too fix there vehicle afterwards, can GM,,help me out with a new electric vehicle, donation,,my car repair is too expensive, ,I was speaking too a local garage in timmins regarding my car ,,2 phone calls  iv made, it's the dealership who sold a Lemmon too you,,I even tried the better business Bureau, ,to get help, unfortunately your car warranty ran out after your chevy cruze broke down outside of your warranty, ,so disappointed in that dealership, ,,kia,,timmins, ,selling me a car that broke down after the warranty expired,,iv checked reviews on kia timmins, ,not good stories, ,so upsetting seeing my new broken car ,,,,can Gm,Canada, ,help me please, ,,can Gm,donate me 1 new electric vehicle,,for our family, ,id be able too take my wife and little girl shopping at Costco and Christmas shopping in Sudbury Ontario Canada, ,3 hr drive, all the wife's medical appointments, ,cause she had a heart attack the year before, ,things did a flip everything was going wrong wife heart attack, ,me I purchased a used car it broke down after 1 year, ,now her son went into surgery, ,open heart surgery,,a lot of things being need fixing, ,we are looking after her son who had surgery, ,his appointments are 3 ,,1/2,,hrs too Sudbury Ontario,,I have the purchase paperwork still, for my car ,Bill of sale, ,,can GM,,Canada help us",0
x_Fxfp75mrs,GM is beaten by Tesla and retaliates on Twitter. Pathetic,1
x_Fxfp75mrs,No more Ads no more GM in my life. Boycotting Twitter is a shame. Y’all want a single brain customer 🎃🤮🤮🤮 Wokism at best,1
x_Fxfp75mrs,"I am fully restoring a Chevy pickup truck and have put $27,000 in the truck so far.  I will be removing the logos from my Chevy truck tomorrow.  

 Hell I might even put Twitter logos On it instead.   I bet that will catch some eyes. 

That's what I think about your anti-American views.",0
x_Fxfp75mrs,"You left Twitter? Why? Because you are communist traitors and racist bigots?
No loss. Buh bye!",0
x_Fxfp75mrs,"Research everything huh! Address some of these things head on huh! GM can’t even fix the problems your product line has now. Afm/ DOD lifter failure, torque converter’s, transmission’s. You can’t even stand by your product now and you think we trust you with a EV 😂.",0
x_Fxfp75mrs,"I ask that you take away the no option-forced to purchase the $1500 3 year subscription to onstar for any new GM product ? 

Answer that ..",0
x_Fxfp75mrs,Just want you to know that I’ll never purchase another GM vehicle for forcing people to purchase and pay for a $1500/ 3 year subscription to onstar for any new vehicle.,2
x_Fxfp75mrs,Hey I'm an idea person I was thinking I'd like to see some history of the Catolytic converter what works and has  been tried so I'll know to keep going or forget it,0
x_Fxfp75mrs,GM is never welcome in Australia again. Garbage car company after what they did to Holden. Chev not popular  or GM.,0
x_Fxfp75mrs,"No other automaker. 

Tesla. 👀",0
x_Fxfp75mrs,How about making a basic five speed truck.  I dont want a truck with all the dials and buttons.  I dont need heated seats and automatic everything.  I just want a basic truck that is reliable and safe.  Something I can drive for ten plus years and then give to one of my kids when I buy a new one.  Come on GM.  Can't you do that?,0
x_Fxfp75mrs,Gordon Johnson's dad??? hmmm,0
x_Fxfp75mrs,General Motors is the BEST company of the WORLD !,1
x_Fxfp75mrs,"1.What Are In General Motors (J-Body) Platform for Cars (Coupes-Sedans-Convertibles-Station Wagons) on 1st-3rd Generations in Exterior/Interior-(Updates) Used from (1981-2005 Makes/Models Updated History) is?

2.What Are In General Motors (J-Body) Platform on Automatic and Manual Transmission (Floor/Console Mounted) Shifters Used from (1981-2005 Makes/Models Updated History) is?",0
x_Fxfp75mrs,"1.What Are In General Motors (N-Body) Platform for Cars (Coupes-Sedans) on 1st-3rd Generations in Exterior/Interior-(Updates) Used from (1984-2005 Makes/Models Updated History) is?

2.What Are In General Motors (N-Body) Platform on Automatic and Manual Transmission (Floor/Console & Steering Column Mounted) Shifters Used from (1984-2005 Makes/Models Updated History) is?",0
x_Fxfp75mrs,"1.What Are In General Motors (W-Body) Platform for Cars (Coupes-Sedans-Convertibles) on 1st-3rd Generations in Exterior/Interior-(Updates) Used from (1987-2016 Makes/Models Updated History) is?

2.What Are In General Motors (W-Body) Platform on Automatic and Manual Transmission (Floor/Console & Steering Column Mounted) Shifters Used from (1987-2016 Makes/Models Updated History) is?",0
x_Fxfp75mrs,"I hope this video tells us more about when my Cadillac Lyriq will get delivered vs saying Summer or Fall.  Also, will it have Ultra Cruise updates, the Qualcomm Snapdragon Digital Chassis reads as if it can handle it.  Also, will there be augmented reality since it won't have the HUD?  I am getting nervous and wondering if I should wait for the 2024 model.  Thank you guys for putting this out.  I am watching it now.",0
x_Fxfp75mrs,"日本には、日本特有の独自の土地の特徴があるから、
その特徴に合わせた生活様式を確立してきたんよ。

この俺様の言葉を理解したかったら、日本語を習ってねー。",0
x_Fxfp75mrs,Very informative video given it’s short duration.  Also liked the format.,3
x_Fxfp75mrs,Design self charging ev car and trucks..add generator to axle drive train and or differential s..dual battery charge and discharge set up..this Design will charge itself..no need to stop to charge,0
x_Fxfp75mrs,GM can’t even make a decent gas powered vehicle they need to master that before they try there hands at electric engines.,1
x_Fxfp75mrs,There is also the Buick Electra SUV coming out for the 2024 model year.,1
x_Fxfp75mrs,"why GM CLOSED ITS PLANTS, WORLD WIDE ...WITHOUT TAKING CARE OF ITS OWN EMPLOYEES.... HOW PEOPLE TRUST IF GM CLOSED ITS FACTORY WITHIN 10-15 YEARS ...PEOPLE NOT HAPPY BECAUSE OF FACTROY CLOSER SPARE  availability ISSUES",0
x_Fxfp75mrs,"When are we gonna see an electric Camaro (that is NOT an SUV, don’t do that to yourselves)?",0
